<?xml version='1.0' encoding="utf-8" ?>
<!DOCTYPE scene SYSTEM "scene.dtd">

<scene nom="Main">
	<camera>
		<position x="40" y="15" z="0" />
	</camera>

	<materiaux>
	</materiaux>

	<lumieres>
		<lumiere nom="Light1" >
			<position x="1" y="10" z="4" />
			<ambient r="0.2" g="0.2" b="0.2" />
			<diffuse r="0.8" g="0.8" b="0.8" />
			<specular r="0.8" g="0.8" b="0.8" />
		</lumiere>
	</lumieres>

	<shaders>
		<shader nom="bump" fragment="shaders/bump.frag" vertex="shaders/test.vert" />
	</shaders>

	<pieces>
		<piece nom="piÃ¨ce1" shader="bump" mat="Mat1">
			<dimension width="12" length="10" height="10" />
			<position x="0" y="0" z="0" />

			<objets>

				<objet nom="objet2" modele="modeles/twilight/twilight.obj" Xrot="0" Yrot="90" Zrot="0" >
					<position x="0" y="0" z="0" />
				</objet>


			</objets>
		</piece>
	</pieces>
</scene>