<?xml version='1.0' encoding="utf-8" ?>
<!DOCTYPE scene SYSTEM "scene.dtd">

<scene nom="Main">
	<camera>
		<position repere="world" x="12.45" y="1" z="0" />
	</camera>

	<materiaux>
		<material nom="Mat1">
			<ambient r="10" g="10" b="10" a="1.0" />
			<diffuse r="124" g="120" b="0" a="1.0" />
			<specular r="12" g="123" b="24" a="1.0" s="32" />
			<emissive r="123" g="145" b="12" a="125" />
			<texture src="path" /> 
		</material>
		<material nom="Mat2">
			<ambient r="10" g="10" b="10" a="1.0" />
			<diffuse r="124" g="120" b="0" a="1.0" />
			<specular r="12" g="123" b="24" a="1.0" s="32" />
			<emissive r="123" g="145" b="12" a="125" />
		</material>
		<material nom="Mat2">
			<ambient r="10" g="10" b="10" a="1.0" />
			<diffuse r="124" g="120" b="0" a="1.0" />
			<specular r="12" g="123" b="24" a="1.0" s="32" />
			<emissive r="123" g="145" b="12" a="125" />
		</material>
	</materiaux>

	<lumieres>
		<lumiere nom="Light1" mat="Mat2" >
<!-- 			<position repere="world|eye|model" x="1" y="1" z="1" /> -->
			<position repere="world" x="1" y="1" z="1" />
		</lumiere>
		<lumiere nom="Light2" mat="Mat1" >
			<position repere="world" x="1" y="1" z="4" />
		</lumiere>
	</lumieres>

	<pieces>
		<piece nom="piÃ¨ce1">
			<dimension largeur="12" longueur="1" hauteur="3" />
			<position repere="world" x="0" y="0" z="0" />
			<murs>
<!--				<mur cote="avant|arriere|droite|gauche|haut|bas" mat="Mat1" /> -->
					<mur cote="avant" mat="Mat1" />
			</murs>

			<objets>
				<objet nom="objet1" mat="Mat2" modele="chaise" Xrot="12" Yrot="3" Zrot="0" >
					<position x="12" y="1" z="0" />
				</objet>
				<objet nom="objet2" mat="Mat2" modele="lavabo" >
					<position relatif="objet1" x="1" y="5" z="0" />
				</objet>
			</objets>
		</piece>
	</pieces>
</scene>