<?xml version='1.0' encoding="utf-8" ?>
<!DOCTYPE scene SYSTEM "scene.dtd">

<scene nom="Main">
	<camera>
		<position repere="world" x="12.45" y="1" z="0" />
	</camera>

	<materiaux>
		<material nom="Mat1">
			<ambient r="0.2" g="0.2" b="0.2" a="1.0" />
			<diffuse r="0.8" g="0.8" b="0.8" a="1.0" />
			<specular r="0.8" g="0.8" b="0.8" a="1.0" s="32" />
			<emissive r="0.0" g="0.0" b="0.0" a="0.0" />
			<texture src="path" /> 
		</material>
	</materiaux>

	<lumieres>
		<lumiere nom="Light2" mat="Mat1" >
			<position repere="world" x="1" y="1" z="4" />
		</lumiere>
	</lumieres>

	<shaders>
		<shader nom="test" fragment="test.frag" vertex="test.vert" />
	</shaders>

	<pieces>
		<piece nom="piÃ¨ce1" shader="test">
			<dimension width="12" length="5" height="3" />
			<position repere="world" x="0" y="0" z="0" />
			<murs>
				<!-- <mur cote="avant|arriere|droite|gauche|haut|bas" mat="Mat1" />  -->
					<mur cote="avant" mat="Mat1" >
						<fenetre x="2" y="3" width="1" height="2" />
					</mur>
			</murs>

			<objets>
				<objet nom="objet1" mat="Mat2" modele="chaise" Xrot="12" Yrot="3" Zrot="0" >
					<position x="12" y="1" z="0" />
				</objet>
				<objet nom="objet2" mat="Mat2" modele="lavabo" >
					<position relatif="objet1" x="1" y="5" z="0" />
				</objet>
			</objets>
		</piece>
		<piece nom="piece2" >
		</piece>
	</pieces>
</scene>